{
  "schema_version": "1.0.0",
  "scenario_id": "wb_v1_007_capacity_bottleneck",
  "time_unit": "minute",
  "notes": [
    "Workbench v1 validation Case 007: airport departure-capacity bottleneck at hub B.",
    "Four independent flights depart B inside 09:00-10:00. Each has exactly one delayed alternative at 10:05, outside the constrained half-open interval.",
    "Distinct equipment/rating types E1-E4 eliminate aircraft and crew reassignment alternatives, isolating the SRM airport-capacity decision.",
    "Aircraft Strings and Crew Pairings are intentionally empty; formal Solve generates them dynamically."
  ],
  "flight_options": [
    {
      "option_id": "WB7_F101_ORIG",
      "base_flight_id": "WB7_F101",
      "operation_type": "operate",
      "change_types": [
        "unchanged"
      ],
      "origin": "B",
      "destination": "A",
      "dep_time": "2026-01-15T09:05:00Z",
      "arr_time": "2026-01-15T10:05:00Z",
      "block_minutes": 60,
      "departure_delay_minutes": 0,
      "arrival_delay_minutes": 0,
      "notes": "Original departure in the constrained 09:00-10:00 B window."
    },
    {
      "option_id": "WB7_F101_D60",
      "base_flight_id": "WB7_F101",
      "operation_type": "operate",
      "change_types": [
        "delay"
      ],
      "origin": "B",
      "destination": "A",
      "dep_time": "2026-01-15T10:05:00Z",
      "arr_time": "2026-01-15T11:05:00Z",
      "block_minutes": 60,
      "departure_delay_minutes": 60,
      "arrival_delay_minutes": 60,
      "notes": "Moves F101 to the next B capacity interval."
    },
    {
      "option_id": "WB7_F102_ORIG",
      "base_flight_id": "WB7_F102",
      "operation_type": "operate",
      "change_types": [
        "unchanged"
      ],
      "origin": "B",
      "destination": "C",
      "dep_time": "2026-01-15T09:15:00Z",
      "arr_time": "2026-01-15T10:15:00Z",
      "block_minutes": 60,
      "departure_delay_minutes": 0,
      "arrival_delay_minutes": 0,
      "notes": "Original departure in the constrained 09:00-10:00 B window."
    },
    {
      "option_id": "WB7_F102_D50",
      "base_flight_id": "WB7_F102",
      "operation_type": "operate",
      "change_types": [
        "delay"
      ],
      "origin": "B",
      "destination": "C",
      "dep_time": "2026-01-15T10:05:00Z",
      "arr_time": "2026-01-15T11:05:00Z",
      "block_minutes": 60,
      "departure_delay_minutes": 50,
      "arrival_delay_minutes": 50,
      "notes": "Moves F102 to the next B capacity interval."
    },
    {
      "option_id": "WB7_F103_ORIG",
      "base_flight_id": "WB7_F103",
      "operation_type": "operate",
      "change_types": [
        "unchanged"
      ],
      "origin": "B",
      "destination": "D",
      "dep_time": "2026-01-15T09:25:00Z",
      "arr_time": "2026-01-15T10:25:00Z",
      "block_minutes": 60,
      "departure_delay_minutes": 0,
      "arrival_delay_minutes": 0,
      "notes": "Original departure in the constrained 09:00-10:00 B window."
    },
    {
      "option_id": "WB7_F103_D40",
      "base_flight_id": "WB7_F103",
      "operation_type": "operate",
      "change_types": [
        "delay"
      ],
      "origin": "B",
      "destination": "D",
      "dep_time": "2026-01-15T10:05:00Z",
      "arr_time": "2026-01-15T11:05:00Z",
      "block_minutes": 60,
      "departure_delay_minutes": 40,
      "arrival_delay_minutes": 40,
      "notes": "Moves F103 to the next B capacity interval."
    },
    {
      "option_id": "WB7_F104_ORIG",
      "base_flight_id": "WB7_F104",
      "operation_type": "operate",
      "change_types": [
        "unchanged"
      ],
      "origin": "B",
      "destination": "A",
      "dep_time": "2026-01-15T09:35:00Z",
      "arr_time": "2026-01-15T10:35:00Z",
      "block_minutes": 60,
      "departure_delay_minutes": 0,
      "arrival_delay_minutes": 0,
      "notes": "Original departure in the constrained 09:00-10:00 B window."
    },
    {
      "option_id": "WB7_F104_D30",
      "base_flight_id": "WB7_F104",
      "operation_type": "operate",
      "change_types": [
        "delay"
      ],
      "origin": "B",
      "destination": "A",
      "dep_time": "2026-01-15T10:05:00Z",
      "arr_time": "2026-01-15T11:05:00Z",
      "block_minutes": 60,
      "departure_delay_minutes": 30,
      "arrival_delay_minutes": 30,
      "notes": "Moves F104 to the next B capacity interval."
    }
  ],
  "aircraft_strings": [],
  "crew_pairings": [],
  "passenger_itineraries": []
}
