{
  "schema_version": "1.0.0",
  "scenario_id": "toy_case_009_passenger_itinerary_generator",
  "time_unit": "minute",
  "notes": ["Phase 7 tiny exhaustive-oracle fixture."],
  "flight_options": [
    {"option_id": "S9_FO_F1_ORIG", "base_flight_id": "S9_F1", "operation_type": "operate", "change_types": ["unchanged"], "origin": "A", "destination": "D", "dep_time": "2026-01-15T09:00:00Z", "arr_time": "2026-01-15T10:00:00Z", "block_minutes": 60, "departure_delay_minutes": 0, "arrival_delay_minutes": 0, "notes": "Legal direct and early-arrival path."},
    {"option_id": "S9_FO_F2_ORIG", "base_flight_id": "S9_F2", "operation_type": "operate", "change_types": ["unchanged"], "origin": "A", "destination": "B", "dep_time": "2026-01-15T08:30:00Z", "arr_time": "2026-01-15T09:00:00Z", "block_minutes": 30, "departure_delay_minutes": 0, "arrival_delay_minutes": 0, "notes": ""},
    {"option_id": "S9_FO_F3_ORIG", "base_flight_id": "S9_F3", "operation_type": "operate", "change_types": ["unchanged"], "origin": "B", "destination": "D", "dep_time": "2026-01-15T09:30:00Z", "arr_time": "2026-01-15T10:30:00Z", "block_minutes": 60, "departure_delay_minutes": 0, "arrival_delay_minutes": 0, "notes": "Exact 30-minute MCT."},
    {"option_id": "S9_FO_F4_ORIG", "base_flight_id": "S9_F4", "operation_type": "operate", "change_types": ["unchanged"], "origin": "B", "destination": "D", "dep_time": "2026-01-15T09:29:00Z", "arr_time": "2026-01-15T10:29:00Z", "block_minutes": 60, "departure_delay_minutes": 0, "arrival_delay_minutes": 0, "notes": "MCT minus one minute."},
    {"option_id": "S9_FO_F5_ORIG", "base_flight_id": "S9_F5", "operation_type": "operate", "change_types": ["unchanged"], "origin": "A", "destination": "C", "dep_time": "2026-01-15T08:40:00Z", "arr_time": "2026-01-15T09:10:00Z", "block_minutes": 30, "departure_delay_minutes": 0, "arrival_delay_minutes": 0, "notes": ""},
    {"option_id": "S9_FO_F6_ORIG", "base_flight_id": "S9_F6", "operation_type": "operate", "change_types": ["unchanged"], "origin": "C", "destination": "D", "dep_time": "2026-01-15T09:50:00Z", "arr_time": "2026-01-15T10:50:00Z", "block_minutes": 60, "departure_delay_minutes": 0, "arrival_delay_minutes": 0, "notes": "Twenty-minute arrival delay."},
    {"option_id": "S9_FO_F2_REROUTE", "base_flight_id": "S9_F2", "operation_type": "operate", "change_types": ["delay", "origin_change", "destination_change", "block_time_change"], "origin": "B", "destination": "D", "dep_time": "2026-01-15T09:30:00Z", "arr_time": "2026-01-15T10:30:00Z", "block_minutes": 60, "departure_delay_minutes": 60, "arrival_delay_minutes": 90, "notes": "Same-base-flight edge negative case."},
    {"option_id": "S9_FO_F1_CANCEL", "base_flight_id": "S9_F1", "operation_type": "cancel", "change_types": ["cancel"], "origin": null, "destination": null, "dep_time": null, "arr_time": null, "block_minutes": null, "departure_delay_minutes": null, "arrival_delay_minutes": null, "notes": ""},
    {"option_id": "S9_FO_FERRY_AD", "base_flight_id": null, "operation_type": "ferry", "change_types": ["positioning"], "origin": "A", "destination": "D", "dep_time": "2026-01-15T08:10:00Z", "arr_time": "2026-01-15T08:50:00Z", "block_minutes": 40, "departure_delay_minutes": null, "arrival_delay_minutes": null, "notes": "Passenger generator must exclude ferry."}
  ],
  "aircraft_strings": [],
  "crew_pairings": [],
  "passenger_itineraries": [
    {"itinerary_id": "S9_PI_P1_ORIGINAL", "pax_group_id": "S9_P1", "status": "transported", "segments": [{"segment_type": "flight", "flight_option_id": "S9_FO_F2_ORIG", "origin": null, "destination": null, "dep_time": null, "arr_time": null}, {"segment_type": "flight", "flight_option_id": "S9_FO_F3_ORIG", "origin": null, "destination": null, "dep_time": null, "arr_time": null}], "final_destination": "D", "arrival_time": "2026-01-15T10:30:00Z", "arrival_delay_minutes": 0, "cost_components": {}, "notes": ""},
    {"itinerary_id": "S9_PI_P1_UNSERVED", "pax_group_id": "S9_P1", "status": "unserved", "segments": [], "final_destination": null, "arrival_time": null, "arrival_delay_minutes": null, "cost_components": {}, "notes": ""},
    {"itinerary_id": "S9_PI_P2_ORIGINAL", "pax_group_id": "S9_P2", "status": "transported", "segments": [{"segment_type": "flight", "flight_option_id": "S9_FO_F5_ORIG", "origin": null, "destination": null, "dep_time": null, "arr_time": null}, {"segment_type": "flight", "flight_option_id": "S9_FO_F6_ORIG", "origin": null, "destination": null, "dep_time": null, "arr_time": null}], "final_destination": "D", "arrival_time": "2026-01-15T10:50:00Z", "arrival_delay_minutes": 0, "cost_components": {}, "notes": ""},
    {"itinerary_id": "S9_PI_P2_UNSERVED", "pax_group_id": "S9_P2", "status": "unserved", "segments": [], "final_destination": null, "arrival_time": null, "arrival_delay_minutes": null, "cost_components": {}, "notes": ""}
  ]
}
