{
  "schema_version": "1.0.0",
  "scenario_id": "toy_case_013_benders_column_generation",
  "time_unit": "minute",
  "notes": ["Phase 11 toy: Schedule A has certified Aircraft infeasibility; B has expensive passenger recourse; C is integrated-optimal."],
  "flight_options": [
    {"option_id": "FO_T13_F1_ORIG", "base_flight_id": "T13_F1", "operation_type": "operate", "change_types": ["unchanged"], "origin": "A", "destination": "B", "dep_time": "2026-01-15T08:00:00Z", "arr_time": "2026-01-15T09:00:00Z", "block_minutes": 60, "departure_delay_minutes": 0, "arrival_delay_minutes": 0, "notes": "Schedule A: Aircraft pricing rejects departure during the 08:00 curfew."},
    {"option_id": "FO_T13_F1_D10", "base_flight_id": "T13_F1", "operation_type": "operate", "change_types": ["delay"], "origin": "A", "destination": "B", "dep_time": "2026-01-15T08:10:00Z", "arr_time": "2026-01-15T09:10:00Z", "block_minutes": 60, "departure_delay_minutes": 10, "arrival_delay_minutes": 10, "notes": "Schedule B: resource-feasible but passengers must be unserved."},
    {"option_id": "FO_T13_F1_D20", "base_flight_id": "T13_F1", "operation_type": "operate", "change_types": ["delay"], "origin": "A", "destination": "B", "dep_time": "2026-01-15T08:20:00Z", "arr_time": "2026-01-15T09:20:00Z", "block_minutes": 60, "departure_delay_minutes": 20, "arrival_delay_minutes": 20, "notes": "Schedule C: slightly higher schedule cost and cheapest total recovery."}
  ],
  "aircraft_strings": [],
  "crew_pairings": [],
  "passenger_itineraries": [
    {"itinerary_id": "PI_T13_P1_ORIG", "pax_group_id": "T13_P1", "status": "transported", "segments": [{"segment_type": "flight", "flight_option_id": "FO_T13_F1_ORIG", "origin": null, "destination": null, "dep_time": null, "arr_time": null}], "final_destination": "B", "arrival_time": "2026-01-15T09:00:00Z", "arrival_delay_minutes": 0, "cost_components": {}, "notes": "Only usable with Schedule A."},
    {"itinerary_id": "PI_T13_P1_D20", "pax_group_id": "T13_P1", "status": "transported", "segments": [{"segment_type": "flight", "flight_option_id": "FO_T13_F1_D20", "origin": null, "destination": null, "dep_time": null, "arr_time": null}], "final_destination": "B", "arrival_time": "2026-01-15T09:20:00Z", "arrival_delay_minutes": 20, "cost_components": {}, "notes": "Schedule C transported alternative."},
    {"itinerary_id": "PI_T13_P1_UNSERVED", "pax_group_id": "T13_P1", "status": "unserved", "segments": [], "final_destination": null, "arrival_time": null, "arrival_delay_minutes": null, "cost_components": {}, "notes": "Fallback for Schedule B."}
  ]
}
