{
  "schema_version": "1.0.0",
  "scenario_id": "wb_v1_004_aircraft_swap",
  "time_unit": "minute",
  "notes": [
    "Workbench v1 validation Case 004: aircraft recovery via a compatible spare aircraft positioned at B.",
    "WB4_AC1 is delayed on F101 and cannot reach B in time for F102. WB4_AC2 is an E1 spare at B and can cover F102/F103, returning to B. WB4_AC1 later operates F104 back to A.",
    "Crew pairings are deliberately split so that crew feasibility remains independent of the aircraft substitution.",
    "Aircraft Strings and Crew Pairings are intentionally empty; formal Solve generates them dynamically."
  ],
  "flight_options": [
    {
      "option_id": "WB4_F101_ORIG",
      "base_flight_id": "WB4_F101",
      "operation_type": "operate",
      "change_types": [
        "unchanged"
      ],
      "origin": "A",
      "destination": "B",
      "dep_time": "2026-01-15T08:00:00Z",
      "arr_time": "2026-01-15T09:00:00Z",
      "block_minutes": 60,
      "departure_delay_minutes": 0,
      "arrival_delay_minutes": 0,
      "notes": "Original departure lies inside the A closure and is infeasible."
    },
    {
      "option_id": "WB4_F101_D60",
      "base_flight_id": "WB4_F101",
      "operation_type": "operate",
      "change_types": [
        "delay"
      ],
      "origin": "A",
      "destination": "B",
      "dep_time": "2026-01-15T09:00:00Z",
      "arr_time": "2026-01-15T10:00:00Z",
      "block_minutes": 60,
      "departure_delay_minutes": 60,
      "arrival_delay_minutes": 60,
      "notes": "First feasible departure after the A closure."
    },
    {
      "option_id": "WB4_F101_CANCEL",
      "base_flight_id": "WB4_F101",
      "operation_type": "cancel",
      "change_types": [
        "cancel"
      ],
      "origin": null,
      "destination": null,
      "dep_time": null,
      "arr_time": null,
      "block_minutes": null,
      "departure_delay_minutes": null,
      "arrival_delay_minutes": null,
      "notes": "Fallback cancel option."
    },
    {
      "option_id": "WB4_F102_ORIG",
      "base_flight_id": "WB4_F102",
      "operation_type": "operate",
      "change_types": [
        "unchanged"
      ],
      "origin": "B",
      "destination": "C",
      "dep_time": "2026-01-15T09:30:00Z",
      "arr_time": "2026-01-15T10:30:00Z",
      "block_minutes": 60,
      "departure_delay_minutes": 0,
      "arrival_delay_minutes": 0,
      "notes": "Can be covered on time by spare aircraft WB4_AC2 already positioned at B."
    },
    {
      "option_id": "WB4_F102_D30",
      "base_flight_id": "WB4_F102",
      "operation_type": "operate",
      "change_types": [
        "delay"
      ],
      "origin": "B",
      "destination": "C",
      "dep_time": "2026-01-15T10:00:00Z",
      "arr_time": "2026-01-15T11:00:00Z",
      "block_minutes": 60,
      "departure_delay_minutes": 30,
      "arrival_delay_minutes": 30,
      "notes": "Fallback all-original-aircraft recovery after WB4_AC1 reaches B at 10:00."
    },
    {
      "option_id": "WB4_F102_CANCEL",
      "base_flight_id": "WB4_F102",
      "operation_type": "cancel",
      "change_types": [
        "cancel"
      ],
      "origin": null,
      "destination": null,
      "dep_time": null,
      "arr_time": null,
      "block_minutes": null,
      "departure_delay_minutes": null,
      "arrival_delay_minutes": null,
      "notes": "Fallback cancel option."
    },
    {
      "option_id": "WB4_F103_ORIG",
      "base_flight_id": "WB4_F103",
      "operation_type": "operate",
      "change_types": [
        "unchanged"
      ],
      "origin": "C",
      "destination": "B",
      "dep_time": "2026-01-15T10:40:00Z",
      "arr_time": "2026-01-15T11:40:00Z",
      "block_minutes": 60,
      "departure_delay_minutes": 0,
      "arrival_delay_minutes": 0,
      "notes": "Returns spare aircraft WB4_AC2 to its required terminal B."
    },
    {
      "option_id": "WB4_F103_D20",
      "base_flight_id": "WB4_F103",
      "operation_type": "operate",
      "change_types": [
        "delay"
      ],
      "origin": "C",
      "destination": "B",
      "dep_time": "2026-01-15T11:00:00Z",
      "arr_time": "2026-01-15T12:00:00Z",
      "block_minutes": 60,
      "departure_delay_minutes": 20,
      "arrival_delay_minutes": 20,
      "notes": "Fallback continuation if WB4_AC1 operates delayed F102."
    },
    {
      "option_id": "WB4_F103_CANCEL",
      "base_flight_id": "WB4_F103",
      "operation_type": "cancel",
      "change_types": [
        "cancel"
      ],
      "origin": null,
      "destination": null,
      "dep_time": null,
      "arr_time": null,
      "block_minutes": null,
      "departure_delay_minutes": null,
      "arrival_delay_minutes": null,
      "notes": "Fallback cancel option."
    },
    {
      "option_id": "WB4_F104_ORIG",
      "base_flight_id": "WB4_F104",
      "operation_type": "operate",
      "change_types": [
        "unchanged"
      ],
      "origin": "B",
      "destination": "A",
      "dep_time": "2026-01-15T12:00:00Z",
      "arr_time": "2026-01-15T13:00:00Z",
      "block_minutes": 60,
      "departure_delay_minutes": 0,
      "arrival_delay_minutes": 0,
      "notes": "Allows delayed WB4_AC1 to return from B to required terminal A."
    },
    {
      "option_id": "WB4_F104_CANCEL",
      "base_flight_id": "WB4_F104",
      "operation_type": "cancel",
      "change_types": [
        "cancel"
      ],
      "origin": null,
      "destination": null,
      "dep_time": null,
      "arr_time": null,
      "block_minutes": null,
      "departure_delay_minutes": null,
      "arrival_delay_minutes": null,
      "notes": "Fallback cancel option."
    }
  ],
  "aircraft_strings": [],
  "crew_pairings": [],
  "passenger_itineraries": []
}
