{
  "schema_version": "1.0.0",
  "scenario_id": "toy_case_010_fixed_column_benders",
  "time_unit": "minute",
  "notes": ["Phase 8 toy: infeasible cheapest schedule, expensive recourse schedule, and integrated-optimal schedule."],
  "flight_options": [
    {"option_id": "FO_T10_F1_ORIG", "base_flight_id": "T10_F1", "operation_type": "operate", "change_types": ["unchanged"], "origin": "A", "destination": "B", "dep_time": "2026-01-15T08:00:00Z", "arr_time": "2026-01-15T09:00:00Z", "block_minutes": 60, "departure_delay_minutes": 0, "arrival_delay_minutes": 0, "notes": "Cheapest SRM schedule; deliberately has no aircraft string."},
    {"option_id": "FO_T10_F1_D10", "base_flight_id": "T10_F1", "operation_type": "operate", "change_types": ["delay"], "origin": "A", "destination": "B", "dep_time": "2026-01-15T08:10:00Z", "arr_time": "2026-01-15T09:10:00Z", "block_minutes": 60, "departure_delay_minutes": 10, "arrival_delay_minutes": 10, "notes": "Feasible resource schedule with only UNSERVED passenger recourse."},
    {"option_id": "FO_T10_F1_D20", "base_flight_id": "T10_F1", "operation_type": "operate", "change_types": ["delay"], "origin": "A", "destination": "B", "dep_time": "2026-01-15T08:20:00Z", "arr_time": "2026-01-15T09:20:00Z", "block_minutes": 60, "departure_delay_minutes": 20, "arrival_delay_minutes": 20, "notes": "Slightly higher SRM cost but lowest total recourse schedule."}
  ],
  "aircraft_strings": [
    {"string_id": "AS_T10_AC1_D10", "aircraft_id": "T10_AC1", "leg_option_ids": ["FO_T10_F1_D10"], "start_station": "A", "end_station": "B", "maintenance_satisfied": true, "cost_components": {}, "notes": ""},
    {"string_id": "AS_T10_AC1_D20", "aircraft_id": "T10_AC1", "leg_option_ids": ["FO_T10_F1_D20"], "start_station": "A", "end_station": "B", "maintenance_satisfied": true, "cost_components": {}, "notes": ""}
  ],
  "crew_pairings": [
    {"pairing_id": "CP_T10_C1_ORIG", "crew_id": "T10_C1", "duties": [{"duty_id": "CP_T10_C1_ORIG_D1", "segments": [{"segment_type": "operate", "flight_option_id": "FO_T10_F1_ORIG", "origin": null, "destination": null, "start_time": null, "end_time": null, "notes": ""}]}], "start_station": "A", "end_station": "B", "cost_components": {}, "notes": ""},
    {"pairing_id": "CP_T10_C1_D10", "crew_id": "T10_C1", "duties": [{"duty_id": "CP_T10_C1_D10_D1", "segments": [{"segment_type": "operate", "flight_option_id": "FO_T10_F1_D10", "origin": null, "destination": null, "start_time": null, "end_time": null, "notes": ""}]}], "start_station": "A", "end_station": "B", "cost_components": {}, "notes": ""},
    {"pairing_id": "CP_T10_C1_D20", "crew_id": "T10_C1", "duties": [{"duty_id": "CP_T10_C1_D20_D1", "segments": [{"segment_type": "operate", "flight_option_id": "FO_T10_F1_D20", "origin": null, "destination": null, "start_time": null, "end_time": null, "notes": ""}]}], "start_station": "A", "end_station": "B", "cost_components": {}, "notes": ""}
  ],
  "passenger_itineraries": [
    {"itinerary_id": "PI_T10_P1_ORIG", "pax_group_id": "T10_P1", "status": "transported", "segments": [{"segment_type": "flight", "flight_option_id": "FO_T10_F1_ORIG", "origin": null, "destination": null, "dep_time": null, "arr_time": null}], "final_destination": "B", "arrival_time": "2026-01-15T09:00:00Z", "arrival_delay_minutes": 0, "cost_components": {}, "notes": ""},
    {"itinerary_id": "PI_T10_P1_D20", "pax_group_id": "T10_P1", "status": "transported", "segments": [{"segment_type": "flight", "flight_option_id": "FO_T10_F1_D20", "origin": null, "destination": null, "dep_time": null, "arr_time": null}], "final_destination": "B", "arrival_time": "2026-01-15T09:20:00Z", "arrival_delay_minutes": 20, "cost_components": {}, "notes": ""},
    {"itinerary_id": "PI_T10_P1_UNSERVED", "pax_group_id": "T10_P1", "status": "unserved", "segments": [], "final_destination": null, "arrival_time": null, "arrival_delay_minutes": null, "cost_components": {}, "notes": ""}
  ]
}
