{
  "schema_version": "1.0.0",
  "scenario_id": "wb_v1_006_passenger_connection",
  "time_unit": "minute",
  "notes": [
    "Workbench v1 validation Case 006: passenger missed connection and reaccommodation.",
    "F101 is forced +60, so the 20-passenger group misses original F102. F103 is the only later transported recovery candidate.",
    "Passenger itineraries are explicit because custom Solve bundles with passengers must provide passenger_itineraries; Aircraft Strings and Crew Pairings remain empty for formal dynamic generation.",
    "Distinct equipment/rating types E1/E2/E3 intentionally eliminate aircraft/crew reassignment alternatives."
  ],
  "flight_options": [
    {
      "option_id": "WB6_F101_ORIG",
      "base_flight_id": "WB6_F101",
      "operation_type": "operate",
      "change_types": [
        "unchanged"
      ],
      "origin": "A",
      "destination": "B",
      "dep_time": "2026-01-15T08:00:00Z",
      "arr_time": "2026-01-15T09:00:00Z",
      "block_minutes": 60,
      "departure_delay_minutes": 0,
      "arrival_delay_minutes": 0,
      "notes": "Original first leg; departure lies inside the A closure and is not selectable by the recovered schedule."
    },
    {
      "option_id": "WB6_F101_D60",
      "base_flight_id": "WB6_F101",
      "operation_type": "operate",
      "change_types": [
        "delay"
      ],
      "origin": "A",
      "destination": "B",
      "dep_time": "2026-01-15T09:00:00Z",
      "arr_time": "2026-01-15T10:00:00Z",
      "block_minutes": 60,
      "departure_delay_minutes": 60,
      "arrival_delay_minutes": 60,
      "notes": "Forced recovery option; arrival at B at 10:00 misses F102 at 09:30."
    },
    {
      "option_id": "WB6_F102_ORIG",
      "base_flight_id": "WB6_F102",
      "operation_type": "operate",
      "change_types": [
        "unchanged"
      ],
      "origin": "B",
      "destination": "C",
      "dep_time": "2026-01-15T09:30:00Z",
      "arr_time": "2026-01-15T10:30:00Z",
      "block_minutes": 60,
      "departure_delay_minutes": 0,
      "arrival_delay_minutes": 0,
      "notes": "Original connection flight; remains operational but departs before delayed F101 reaches B."
    },
    {
      "option_id": "WB6_F103_ORIG",
      "base_flight_id": "WB6_F103",
      "operation_type": "operate",
      "change_types": [
        "unchanged"
      ],
      "origin": "B",
      "destination": "C",
      "dep_time": "2026-01-15T11:00:00Z",
      "arr_time": "2026-01-15T12:00:00Z",
      "block_minutes": 60,
      "departure_delay_minutes": 0,
      "arrival_delay_minutes": 0,
      "notes": "Later recovery flight from B to C."
    }
  ],
  "aircraft_strings": [],
  "crew_pairings": [],
  "passenger_itineraries": [
    {
      "itinerary_id": "WB6_PI_PG1_ORIGINAL",
      "pax_group_id": "WB6_PG1",
      "status": "transported",
      "segments": [
        {
          "segment_type": "flight",
          "flight_option_id": "WB6_F101_ORIG",
          "origin": null,
          "destination": null,
          "dep_time": null,
          "arr_time": null
        },
        {
          "segment_type": "flight",
          "flight_option_id": "WB6_F102_ORIG",
          "origin": null,
          "destination": null,
          "dep_time": null,
          "arr_time": null
        }
      ],
      "final_destination": "C",
      "arrival_time": "2026-01-15T10:30:00Z",
      "arrival_delay_minutes": 0,
      "cost_components": {},
      "notes": "Original passenger itinerary; becomes schedule-ineligible because F101_ORIG is not selected."
    },
    {
      "itinerary_id": "WB6_PI_PG1_RECOVER_F103",
      "pax_group_id": "WB6_PG1",
      "status": "transported",
      "segments": [
        {
          "segment_type": "flight",
          "flight_option_id": "WB6_F101_D60",
          "origin": null,
          "destination": null,
          "dep_time": null,
          "arr_time": null
        },
        {
          "segment_type": "flight",
          "flight_option_id": "WB6_F103_ORIG",
          "origin": null,
          "destination": null,
          "dep_time": null,
          "arr_time": null
        }
      ],
      "final_destination": "C",
      "arrival_time": "2026-01-15T12:00:00Z",
      "arrival_delay_minutes": 90,
      "cost_components": {},
      "notes": "Recovered itinerary after missed connection: delayed F101 followed by later F103."
    },
    {
      "itinerary_id": "WB6_PI_PG1_UNSERVED",
      "pax_group_id": "WB6_PG1",
      "status": "unserved",
      "segments": [],
      "final_destination": null,
      "arrival_time": null,
      "arrival_delay_minutes": null,
      "cost_components": {},
      "notes": "Explicit unserved alternative for PRM comparison."
    }
  ]
}
