{
  "schema_version": "1.0.0",
  "scenario_id": "toy_case_015_crew_integrality",
  "time_unit": "minute",
  "notes": ["Phase 12 natural Crew set-partitioning gap: three pair routes at 0.5 versus one exact triple route."],
  "flight_options": [
    {"option_id": "T15_O1", "base_flight_id": "T15_F1", "operation_type": "operate", "change_types": ["unchanged"], "origin": "A", "destination": "B", "dep_time": "2026-01-15T08:00:00Z", "arr_time": "2026-01-15T08:30:00Z", "block_minutes": 30, "departure_delay_minutes": 0, "arrival_delay_minutes": 0, "notes": "Triangle leg 1."},
    {"option_id": "T15_F2_ORIG", "base_flight_id": "T15_F2", "operation_type": "operate", "change_types": ["unchanged"], "origin": "A", "destination": "B", "dep_time": "2026-01-15T09:00:00Z", "arr_time": "2026-01-15T09:30:00Z", "block_minutes": 30, "departure_delay_minutes": 0, "arrival_delay_minutes": 0, "notes": "Semantic original retained for full generation."},
    {"option_id": "T15_O2", "base_flight_id": "T15_F2", "operation_type": "operate", "change_types": ["origin_change", "destination_change"], "origin": "B", "destination": "C", "dep_time": "2026-01-15T09:00:00Z", "arr_time": "2026-01-15T09:30:00Z", "block_minutes": 30, "departure_delay_minutes": 0, "arrival_delay_minutes": 0, "notes": "Triangle leg 2."},
    {"option_id": "T15_F3_ORIG", "base_flight_id": "T15_F3", "operation_type": "operate", "change_types": ["unchanged"], "origin": "A", "destination": "B", "dep_time": "2026-01-15T10:00:00Z", "arr_time": "2026-01-15T10:30:00Z", "block_minutes": 30, "departure_delay_minutes": 0, "arrival_delay_minutes": 0, "notes": "Semantic original retained for full generation."},
    {"option_id": "T15_O3", "base_flight_id": "T15_F3", "operation_type": "operate", "change_types": ["origin_change", "destination_change"], "origin": "C", "destination": "A", "dep_time": "2026-01-15T10:00:00Z", "arr_time": "2026-01-15T10:30:00Z", "block_minutes": 30, "departure_delay_minutes": 0, "arrival_delay_minutes": 0, "notes": "Triangle leg 3."},
    {"option_id": "T15_D1_ORIG", "base_flight_id": "T15_D1", "operation_type": "operate", "change_types": ["unchanged"], "origin": "B", "destination": "A", "dep_time": "2026-01-15T11:00:00Z", "arr_time": "2026-01-15T11:30:00Z", "block_minutes": 30, "departure_delay_minutes": 0, "arrival_delay_minutes": 0, "notes": "Original-duty return leg."},
    {"option_id": "T15_D2_ORIG", "base_flight_id": "T15_D2", "operation_type": "operate", "change_types": ["unchanged"], "origin": "B", "destination": "A", "dep_time": "2026-01-15T11:40:00Z", "arr_time": "2026-01-15T12:10:00Z", "block_minutes": 30, "departure_delay_minutes": 0, "arrival_delay_minutes": 0, "notes": "Original-duty return leg."},
    {"option_id": "T15_D3_ORIG", "base_flight_id": "T15_D3", "operation_type": "operate", "change_types": ["unchanged"], "origin": "B", "destination": "A", "dep_time": "2026-01-15T12:20:00Z", "arr_time": "2026-01-15T12:50:00Z", "block_minutes": 30, "departure_delay_minutes": 0, "arrival_delay_minutes": 0, "notes": "Original-duty return leg."}
  ],
  "aircraft_strings": [],
  "crew_pairings": [],
  "passenger_itineraries": []
}
