{
  "schema_version": "1.0.0",
  "scenario_id": "toy_case_007_string_generator",
  "time_unit": "minute",
  "notes": ["Phase 5 exhaustive Aircraft String enumeration oracle."],
  "flight_options": [
    {"option_id": "S7_O1", "base_flight_id": "S7_F1", "operation_type": "operate", "change_types": ["unchanged"], "origin": "A", "destination": "B", "dep_time": "2026-01-15T08:00:00Z", "arr_time": "2026-01-15T09:00:00Z", "block_minutes": 60, "departure_delay_minutes": 0, "arrival_delay_minutes": 0, "notes": ""},
    {"option_id": "S7_O2", "base_flight_id": "S7_F2", "operation_type": "operate", "change_types": ["unchanged"], "origin": "B", "destination": "C", "dep_time": "2026-01-15T09:10:00Z", "arr_time": "2026-01-15T10:10:00Z", "block_minutes": 60, "departure_delay_minutes": 0, "arrival_delay_minutes": 0, "notes": ""},
    {"option_id": "S7_O3", "base_flight_id": "S7_F3", "operation_type": "operate", "change_types": ["unchanged"], "origin": "B", "destination": "C", "dep_time": "2026-01-15T09:20:00Z", "arr_time": "2026-01-15T10:20:00Z", "block_minutes": 60, "departure_delay_minutes": 0, "arrival_delay_minutes": 0, "notes": ""},
    {"option_id": "S7_O4", "base_flight_id": "S7_F4", "operation_type": "operate", "change_types": ["unchanged"], "origin": "C", "destination": "A", "dep_time": "2026-01-15T10:40:00Z", "arr_time": "2026-01-15T11:40:00Z", "block_minutes": 60, "departure_delay_minutes": 0, "arrival_delay_minutes": 0, "notes": ""},
    {"option_id": "S7_UO1", "base_flight_id": "S7_U1", "operation_type": "operate", "change_types": ["unchanged"], "origin": "D", "destination": "E", "dep_time": "2026-01-15T08:30:00Z", "arr_time": "2026-01-15T09:30:00Z", "block_minutes": 60, "departure_delay_minutes": 0, "arrival_delay_minutes": 0, "notes": ""},
    {"option_id": "S7_CANCEL_F1", "base_flight_id": "S7_F1", "operation_type": "cancel", "change_types": ["cancel"], "origin": null, "destination": null, "dep_time": null, "arr_time": null, "block_minutes": null, "departure_delay_minutes": null, "arrival_delay_minutes": null, "notes": ""},
    {"option_id": "S7_FERRY_AC", "base_flight_id": null, "operation_type": "ferry", "change_types": ["positioning"], "origin": "A", "destination": "C", "dep_time": "2026-01-15T09:00:00Z", "arr_time": "2026-01-15T09:30:00Z", "block_minutes": 30, "departure_delay_minutes": null, "arrival_delay_minutes": null, "notes": "Input ferry option; generator does not create it."}
  ],
  "aircraft_strings": [],
  "crew_pairings": [
    {"pairing_id": "S7_CP1", "crew_id": "S7_C1", "duties": [{"duty_id": "S7_CP1_D1", "segments": [{"segment_type": "operate", "flight_option_id": "S7_O1", "origin": null, "destination": null, "start_time": null, "end_time": null, "notes": ""}, {"segment_type": "operate", "flight_option_id": "S7_O3", "origin": null, "destination": null, "start_time": null, "end_time": null, "notes": ""}, {"segment_type": "operate", "flight_option_id": "S7_O4", "origin": null, "destination": null, "start_time": null, "end_time": null, "notes": ""}]}], "start_station": "A", "end_station": "A", "cost_components": {}, "notes": ""},
    {"pairing_id": "S7_CP2", "crew_id": "S7_C2", "duties": [{"duty_id": "S7_CP2_D1", "segments": [{"segment_type": "operate", "flight_option_id": "S7_UO1", "origin": null, "destination": null, "start_time": null, "end_time": null, "notes": ""}]}], "start_station": "D", "end_station": "E", "cost_components": {}, "notes": ""},
    {"pairing_id": "S7_CP3", "crew_id": "S7_C3", "duties": [{"duty_id": "S7_CP3_D1", "segments": [{"segment_type": "operate", "flight_option_id": "S7_O2", "origin": null, "destination": null, "start_time": null, "end_time": null, "notes": ""}]}], "start_station": "B", "end_station": "C", "cost_components": {}, "notes": ""}
  ],
  "passenger_itineraries": []
}
